Number,Year Erected,Marker Name,Marker Text,Civil War Site?,Notes,Location,Latitude,Longitude,Condition,Mapped Location
172,2018,"Odom's Tennessee Pride Sausage, Inc.","In 1943, with a $1000 loan from a friend, Douglas G. Odom, Sr., his wife Louise, and their children—Doug Jr., Richard, Judy, and June—started a four-hog a day sausage business. Before selling the company in 2012, the three generation family-owned business was one of the largest independent sausage manufacturers in America. The iconic farmboy and slogan, 'Take Home a Package of Tennessee Pride,' were regular features on Grand Ole Opry television broadcasts starting in 1956.",,Council District 9,1145 Neely's Bend Rd.,36.24461,-86.678367,,POINT (-86.678367 36.24461)
173,2018,Old Hickory Works,"In Jan. 1918, the area known as Hadley's Bend was purchased by the U.S. government to build a smokeless gunpowder factory to supply the Allied troops during World War I. The contract for the plant—called Old Hickory Works—was awarded to DuPont Co. Over 7 miles of rail were laid to connect the plant to Hermitage Station, bringing in about 31,000 passengers daily. The almost 5,000 acre property started at the Cumberland River and reached to what is now the Hermitage Golf Course.",,Council District 11,Old Hickory Blvd. at Montchanin Dr.,36.234238,-86.625403,NOT UP YET,POINT (-86.625403 36.234238)
128,2008,Dutchman's Curve Train Wreck,"The deadliest train wreck in U.S. history occurred on July 9, 1918, when two crowded trains collided head-on at Dutchman's Curve. The impact caused passenger cars to derail into surrounding cornfields, and fires broke out throughout the wreckage. Over 100 died, including many African-American workers journeying to work at the munitions plant near Old Hickory.",,Sponsored by the Bellevue Harpeth Historic Association,White Bridge Pike at Richland Creek Greenway Trailhead,36.12713,-86.85044,,POINT (-86.85044 36.12713000000001)
162,2018,Hca Healthcare,"In 1968, Hospital Corporation of America (HCA) was founded by Dr. Thomas Frist Sr., his son Dr. Thomas Frist Jr., and businessman Jack C. Massey. The original office was located here, in a small house near HCA's first hospital—Park View. At the time, it was one of the nation's first hospital companies. With a mission to care for and improve human life, the Nashville-based company, now called HCA Healthcare, has grown into one of the nation's largest healthcare services providers.",,,250 25th Ave N,36.152988,-86.81222,,POINT (-86.81222 36.152988)
209,2019,Olive Branch Missionary Baptist Church,"In 1871, District 6 school commissioners John Briley, Benjiah Gray and Jason Austin bought one acre of land from James Thompson for an African American school. In 1873, African American members of the Benevolent Society of Olive Branch No. 38 established Olive Branch Cemetery. Olive Branch Missionary Baptist Church (est. 1875) used the one-room school for services until the church was built. The church was re-built in 1971. Due to its condition, the school was demolished c. 1980.",,Council District 33,5988 Cane Ridge Road,36.005441,-86.639832,waiting to install,POINT (-86.639832 36.005441)
77,1982,Fall School,"Fall School, built in 1898, is the oldest public school building remaining in Nashville. Named after Mr. P.S. Fall, a prominent Nashville businessman and member of the Board of Education from 1865-1867, it served as an elementary school until 1970. In 1982 it was privately renovated for offices. Unlike the earlier study hall design, Fall School had individual classrooms.",,,1116 Eighth Avenue South,36.141902,-86.778561,,POINT (-86.778561 36.14190200000001)
96,1996,Christ Church Cathedral,"Organized in 1829, Christ Church was Nashville's first Episcopal parish. The present Victorian Gothic church, designed by Francis Hatch Kimball of New York, opened for services on Dec. 16, 1894; the tower, by local architect Russell E. Hart., was added in 1947. Designated the Cathedral for the diocese of Tennessee at the 1995 Diocesan Convention.",,"text on one side, sketch of the original building on the other",900 Broadway,36.158593,-86.782399,,POINT (-86.782399 36.158593)
56,1975,Devon Farm,"Home of John Davis, early surveyor, who came from N.C. to Nashville in 1788. Davis was an Indian fighter & scout in the State Militia until 1795. He settled on Big Harpeth in 1795-96 and that year built a 1½-story home of hand-made brick. The farm, named for Devon cattle bred here, has been owned by seven generations of Davis-Hicks descendants.",,Marker Project- prioirty list replaced with updated text in 2018,Hwy 100 near Devon Farm entrance,,,CURRENTLY MISSING,
187,2019,Dodson School,"As early as 1815, school was held nearby at Stoner's Lick Methodist Church. In 1843, early settler Timothy Dodson granted land for a dedicated schoolhouse that was built c. 1855. After it burned, classes were held at the Hermitage railroad station until a one-room frame school was rebuilt in 1880. Old Dodson School was built in 1936, expanded in 1950 and 1955; it was desegregated Jan. 23, 1961. Dodson School, designed by Nashville architect Earl Swensson, opened here in 1968.",,Council District 12,4401 Chandler Road,36.191264,-86.60361,,POINT (-86.60361 36.191264)
136,2009,Bells Bend,"Bells Bend, first known as White's Bend, is an 18-square-mile area encompassed by a U-shaped bend in the Cumberland River. Numerous archaeological sites indicate that the area has been inhabited for at least 10,000 years. Bells Bend has thrived as an agricultural community since the early 19th century with land owners that included Montgomery Bell and David Lipscomb. The Clees family operated a mill and ferry service beginning in the 1870's. Clees Ferry ceased operation in 1990.",,double-sided,Old Hickory Blvd at Ashland City Highway,36.211694,-86.920493,,POINT (-86.920493 36.211694)
93,1995,Mill Creek Baptist Church and Graveyard,"Mill Creek Baptist Church, mother church of Southern Baptists in Davidson County, occupied two meeting houses at this site from 1797 until the early 20th century. Here, in 1833, Baptists formed the first Tennessee Baptist Convention. The church's graveyard includes the graves of many early settlers of both African and European descent.",,,Glenrose Avenue at Dodge Drive,36.118829,-86.727785,,POINT (-86.727785 36.118829)
41,1971,First Steam Locomotive,"On Dec. 13, 1850, the first steam engine, Tennessee No. 1, ordered by the Nashville & Chattanooga Railroad arrived at the wharf on the steamboat Beauty, from Cincinnati. The one mile trip on improvised track from the wharf to the S. Cherry St. crossing required 4 days by mule power. A one mile run was made from this point on Dec. 27, 1850.",,replaced with updated text 2011,Fourth Avenue South railroad crossing at Hart Street (Dudley Park),36.142497,-86.765044,,POINT (-86.765044 36.142497)
180,2018,Rock City,"Rock City was an African American community established c.1881, which was soon followed by the founding of First Baptist Church Rock City. Named for a rock quarry in the area, the approx. boundaries were Cahal Ave. to the south, Branch St. to the east, Litton Ave. to the north and Pennington Ave. to the west. Community children attended Rock City Elementary on Pennington Ave., which closed in 1954. The Men's Civic Club raised funds to provide support for the church and community.",,Council District 7,1500 Ann St.,36.198592,-86.727957,,POINT (-86.727957 36.198592)
14,1969,Nashville Centennial 1780-1880,"On April 24, 1880, Nashville began a month-long celebration of 100 years since the signing of the Cumberland Compact. Starting with a 100-gun salute at the Capitol, a procession of dignitaries, veterans, businesses and community groups paraded to the Centennial Exposition building here. The evening featured speeches, music and a grand display of fireworks. Vendors sold Centennial Medals bearing the likeness of the recently dedicated Capitol statue of Pres. Andrew Jackson.",,Marker Project- prioirty list replaced with updated text 2018,801 Broadway,36.158322,-86.78247,,POINT (-86.78247 36.158322)
131,2008,Mud Tavern,"The Mud Tavern Community developed around the crossroads of the Elm Hill and McGavock Turnpikes. The name derives from the mud and log inn at the crossroads where early 19th century travelers found rest and refreshment. Mud Tavern later became a lively rural community, with a railway stop, schools, post office, and general store, which thrived until overtaken by 20th century commercial development.",,,2200 Elm Hill Pike,36.152833,-86.689894,,POINT (-86.68989400000001 36.152833)
179,2018,Germantown Brewery District,"Germantown was home to many 19th-cen. European immigrants who brought their trade skills to Nashville, including brewing. By 1865 Germantown was home to 4 breweries: North Nashville Brewery (C. Kreig); Rock City Brewery (F. Kuhn); Cumberland Brewery (J. Ritter); and City Brewery (F. Leitenberger). By the 1870s all of these breweries had closed due to the success of J. Stiefel's S. Nashville Brewing Co. and shipments from Midwestern breweries via iced rail cars and riverboats.",,"text on one side, map on other",1200 5th Ave N,36.175239,-86.787948,,POINT (-86.787948 36.175239)
159,2017,Centenary Methodist Institute,"Women from the Methodist Training School founded Warioto Settlement House in 1908. Renamed Centenary Methodist Institute, CMI moved to this location by 1921. CMI worked with rural migrant families in the North Nashville area called Kalb Hollow, providing a health care clinic and instruction in domestic skills and childcare. Children and teens participated in sports and clubs, directed for many years by Tom Page. CMI merged with Bethlehem Centers of Nashville in 1970.",,"approved in 2015, ordered and installed 2017",614/616 Monroe Street,36.176025,-86.791107,,POINT (-86.791107 36.176025)
166,2018,Paradise Ridge,"Named for the Paradise brothers, early settlers from North Carolina, this ridge was home to the Joelton Air Force Station from 1956-61, when the 799th Aircraft Control and Warning Squadron operated here as a part of the integrated continental defense system against aerial attacks from the Soviet Union. After the station closed, the radar equipment was updated and is still used as part of the FAA Joint Surveillance System. The Paradise Ridge Community Center opened here in 2013.",,Council District 1,"Paradise Ridge Park,  3000 Morgan Rd.",36.335708,-86.85987,,POINT (-86.85987 36.335708)
181,2018,Logue House,"In 1786, the State of North Carolina deeded this land as part of a 640 acre grant to Revolutionary War Private and land surveyor James Mulherin. The c. 1920 stone American Foursquare dwelling was home to Gilbert Stroud Logue and Emma McEwan Logue. Gilbert was a professional Southern Circuit bicycle racer, a Scottish Rite 32nd degree Mason, and an investor in multiple businesses. Emma, a founding member of the Lebanon Road Garden Club, often hosted meetings at this estate.",,Council District 15,115 Cottage Ln.,36.1681,-86.692215,,POINT (-86.692215 36.1681)
69,1976,Tennessee State University,"Tennessee Agricultural & Industrial State Normal School for Negroes first opened its doors to 247 students in 1912. this site gave birth to a new era of public higher education for Negroes in the state of Tennessee with emphasis on agricultural & industrial occupations. In 1922 the school became a college & in 1951, a university.",,,"TSU Campus, 3500 John A. Merritt Blvd, Hankal Hall",36.168123,-86.830108,,POINT (-86.830108 36.168123)
149,2013,Bass Park,"This .2-acre lot was purchased by East Nashville citizens and presented to the city on December 12, 1921 as a public park and playground. The undeveloped lot provided views of the adjacent fire hall and was intended to keep firefighters from being disturbed. Nashville's smallest park, Bass Park was named in honor of Fire Captain Herman Bass, the first captain of the fire hall.",,double-sided,"Bass Park, 1600 Holly Street",36.175477,-86.74195,,POINT (-86.74195 36.175477)
27,1970,City of Edgefield,"The portion of East Nashville known as Edgefield, the name suggested by Gov. Neill S. Brown, was incorporated as a city Jan. 2, 1869. Its approximate bounds were Shelby Ave., Sevier St., So. 10th St., Berry St., Cowan Ave. and the River. It's first mayor was W.A. Glenn and its last was S.M. Wene. It was annexed to the City of Nashville Feb. 6, 1880.",,,South 5th Street and Fatherland Street,36.169946,-86.763934,,POINT (-86.763934 36.169946)
113,2003,Tolbert Fanning 1810-1874,"In 1844, noted educator, evangelist, and agriculturalist Tolbert Fanning started Franklin College, a liberal arts school near this site where boys farmed to cover tuition. In 1855 he co-founded the Gospel Advocate, a religious journal. Fanning's wife, Charlotte Fall, began Fanning Orphan School for girls here in 1884. Their aim was to put education within the 'reach of every youth.'",,,Briley Parkway and Vultee Boulevard,36.124368,-86.696267,,POINT (-86.696267 36.124368)
175,2018,Tennessee Hospital for the Insane,"In 1832, the Tenn. legislature approved the state's first asylum, established in 1840 southwest of Nashville. The State bought this land in 1848, after activist-reformer Dorothea Dix and asylum staff called for improved facilities. Prominent architect Adolphus Heiman designed the Gothic-style complex with octagonal towers and separate wards. Opened in 1852 and renamed Central State Hospital in 1920, it closed in 1995. A stone gatehouse and unmarked graves are all that remain.",,Council District 13,2 Dell Parkway,36.107811,-86.677384,,POINT (-86.677384 36.107811)
154,2013,North Nashville High School,"Located 1100 Clay Street, North Nashville High School opened in 1940. Designed by Hart and Russell, the building was constructed with funding from the Public Works Administration, and featured carved stone panels by sculptor Puryear Mims. The first class graduated in 1941. Four principals served North High: J.H. Noel, W.J. Mullins, L.L. Carnes, and R.W. Elliot. The final commencement was held June 8, 1978. North High was demolished in 1987.",,,1000 Cass Street,36.186379,-86.805722,,POINT (-86.805722 36.186379)
151,2013,Richland Park,"Once a part of the Byrd Douglas plantation, the Nashville Land Improvement Company dedicated ten acres for a public park in 1887. After annexation, the park became a Nashville City Park in 1907, and the City added playground equipment. Richland Park hosted many community events such as ice cream socials, band concerts, outdoor movies, and sporting events. The commmunity center opened in 1932, and was converted in the Richland Park Library in 1961-62.",,,"4711 Charlotte Avenue, in front of Richland Park Library",36.152004,-86.844134,,POINT (-86.844134 36.152004)
20,1969,Ryman Auditorium,"The Union Gospel Tabernacle was built in 1892 after steamboat captain Thomas Ryman heard Rev. Sam P. Jones speak at a tent revival in 1885. Ryman commissioned architect Hugh C. Thompson to build the Gothic Revival church, which quickly became a place for secular and religious gatherings. After Ryman's death in 1904 it was renamed in his honor. Nicknamed the 'Mother Church of Country Music,' the Ryman Auditorium was home to WSM's 'Grand Ole Opry' from 1943-1974.",,Marker Project- prioirty list replaced with updated  text 2018,116 5th Avenue North,36.161237,-86.778856,CURRENTLY DOWN,POINT (-86.778856 36.161237)
141,2011,Rca Studio B,"RCA Records established a recording studio in this building in November 1957, with local offices run by guitarist-producer Chet Atkins. Its success led to a larger studio, known as Studio A, built next door in 1964. Studio B recorded numerous hits by Elvis Presley, the Everly Brothers, Roy Orbison, Don Gibson, Charley Pride, Jim Reeves, Dolly Parton, and many others. Along with Bradley Studios, Studio B is known for developing 'The Nashville Sound.'",,Donated by the Mike Curb Foundation,34 Music Square West,36.15013,-86.793178,,POINT (-86.79317800000001 36.15013)
37,1970,Battle of Nashville Peach Orchard Hill,"On Dec. 16, 1864, Gen. S.D. Lee's Corps, Army of Tennessee, held this right flank of Hood's defense line which ran south along the crest of this ridge. Violent artillery fire & infantry attacks by the corps of Wood & Steedman failed to dislodge the defenders who withdrew only after the collapse of the Confederate left and center in late afternoon.",TRUE,,"North side of Harding Place, East of Franklin Road",36.085754,-86.768892,,POINT (-86.768892 36.08575400000001)
54,1975,Site of Waterworks Plant,"The city's present waterworks was inaugurated at this site Oct. 1, 1833. The pumping station was erected on the lower river bluff & the reservoir on the upper grounds. German engr., Albert Stein, designed and supervised construction. The system cost $55,000, the first bonded debt of the city. A new plant was in operation & this site was abandoned by Apr. 1891.",,,Hermitage Avenue at Academy Place,36.155188,-86.765555,,POINT (-86.765555 36.155188)
213,,Clark Memorial United Methodist Church,"Founded in South Nashville in 1865, Clark Memorial moved to North Nashville in 1936 and to this location in 1945. The church was central to the Civil Rights movement in Nashville, with activist James M. Lawson conducting classes here in 1959 on non-violent protests. Lawson was a founding member of the Student Non-Violent Coordinating Committee (SNCC), whose Nashville members included students at American Baptist College, Fisk Univ., Tenn. A&I (now Tenn. State) and Vanderbilt Univ.",,In Honor of Matthew Walker Jr.,1014 14th Avenue North,36.169394,-86.800271,ordered/ not arrived,POINT (-86.800271 36.169394)
210,2019,Rev. Nelson G. Merry,"The Reverend Nelson G. Merry, born enslaved in 1824 in Kentucky, was brought to Tennessee by his master. At age 16, his widowed mistress willed him to the First Baptist Church. He was freed in 1845. Merry preached to the 'colored' mission of First Baptist, which was established in 1843. When it became 'First Colored Baptist Church' (now First Baptist Church, Capitol Hill) in 1865, Merry, an ordained minister, was named pastor. The Rev. Merry is buried in Mt. Ararat Cemetery.",,,10th Ave N at Nelson Merry St.,36.164449,-86.789276,waiting to install,POINT (-86.78927600000002 36.164449)
7,1968,East Nashville Fire,"Nashville's worst disaster by fire occurred Wednesday, March 22, 1916. It began at 11:47 a.m. in the rear of Seagraves Planing Mill, 80 yards west, and was swept eastwardly by 44 to 51 mph gales.  It was brought under control at 4:30 p.m. near So. Tenth and Dew Streets.  648 buildings were burned, 1 life lost and 3,000 people left homeless.",,,211 North 1st Street,36.175227,-86.774227,,POINT (-86.774227 36.175227)
92,1994,Captain Ryman's Home,"On this site stood the residence of Captain Thomas Green Ryman, owner of the Ryman steamboat line and builder of the Union Gospel Tabernacle, renamed Ryman Auditorium after his death in 1904. The Queen Anne frame house with a slate roof, seven gables and two turrets, served as the home of Captain and Mrs. Ryman and their seven children from 1885-1926. The house was razed in 1940.",,"text on one side, sketch of the building on the other",500 2nd Avenue South,36.156037,-86.771124,,POINT (-86.771124 36.156037)
85,1990,Vine Street Temple,"Nashville's Jewish community began in the 1840s. Many early families were immigrants fleeing oppression in Germany, Russia, and Poland. Completed in 1876, the Vine Street Temple, with nine Byzantine domes was Nashville's first synagogue, for 80 years a symbol of the city's strong Jewish presence. In 1955, the Reform congregation moved to West Nashville where it and other Jewish congregations continue today.",,"text on one side, sketch of the building on the other",Commerce Street and Seventh Avenue North,36.160973,-86.781619,,POINT (-86.781619 36.160973)
123,2005,Watkins Park,"Land once known as Watkins Grove was given to the city in 1870 by brick maker and contractor Samuel Watkins. It served as a site for political gatherings, school commencements and concerts. This became Nashville's first public park in 1901. Park Board chairman E.C. Lewis planned landscape features including a stone entrance and fence, walkways, flowerbeds, and benches, which were built with materials donated by citizens. In 1906, the Centennial Club opened the city's first playground here, setting a precedent for public recreation facilities elsewhere in the city. Improved by the Works Progress Administration in the 1930s, Watkins Park was a park for black Nashvillians from 1936 until the 1960s, when the park system was desegregated.",,,"Watkins Park, Jo Johnston Avenue and Henry Hale Boulevard",36.161798,-86.798944,,POINT (-86.798944 36.161798)
86,1990,Luke Lea Heights 5 Miles Ahead on Scenic Drive,"Luke Lea (1879-1945) envisioned this park, gave to the city in 1927 the original 868 acres, and asked that the land be named for his father-in-law, Percy Warner. Founder of The Nashville Tennessean, Lea was a key developer of Belle Meade, a U.S. senator, organizer and colonel of the 114th Field Artillery, WWI.  To honor him the Park Board named a high hill and overlook Lea Heights.",,,"Belle Meade Boulevard, inside Percy Warner Park",,,,
145,2012,Scarritt College for Christian Workers,"Established in Kansas City in 1892 by the Methodist Episcopal Church South and moved to Nashville in 1924, Scarritt trained laity in Christian education, music, and missions until it closed in 1988. Much of the Collegiate Gothic campus architecture was designed by Nashville architect Henry C. Hibbs.  The campus was listed in the National Register of Historic Places in 1982. A leader in racial integration in the South, Scarritt integrated its student population in 1952. The Rev. Martin Luther King, Jr. spoke in Wightman Chapel to the Conference on Christian Faith and Human Relations on April 25, 1957. From its beginning, Scarritt had an international student population that reflected its commitment to a global understanding of racial justice and equality. Its mission and vision continue today through the Scarritt-Bennett Center.",,Donated by the Scarritt Alumni Association,"In front of Wightman Chapel, 1008 19th Avenue North",36.145991,-86.797257,,POINT (-86.797257 36.145991)
33,1970,Mcconnell Field,"In 1927 the City bought 131 acres from Warren Sloan and made this the Nashville airport, named for Lieut. Brower McConnell, Tennessee National Guard pilot who died that year in an air crash. The hangars were 50 yards east. Aircraft outgrew the field in the 1930s and moved to Sky Harbor and Berry Field. The Park Board began the golf course in 1939.",,,"Murphy Road, by the club house in McCabe Park",36.14117,-86.841381,,POINT (-86.841381 36.14117)
66,1976,Cornelia Fort Airport,"Cornelia Fort (1919-43), Nashville's first woman flying instructor volunteer, Army's WAFS, WWII, was the first woman pilot to die on war duty in American history. 'I am grateful that my one talent, flying, was useful to my country.' she wrote shortly before her death. Miss Fort was lost in a crash over Texas flying a basic-trainer plane, BT 13-A, across the United States.",,,"Cornelia Fort Airport, Airpark Drive",36.190367,-86.70405,,POINT (-86.70405 36.190367)
35,1970,William Walker 'grey-eyed Man of Destiny',"Born May 8, 1824, Walker moved to this site from 6th Ave. N. in 1840. In early life he was doctor, lawyer, & journalist. He invaded Mexico in 1853 with 46 men & proclaimed himself Pres., Republic of Lower Calif. Led force into Nicaragua in 1855; was elected its Pres. in 1856. In attempt to wage war on Honduras was captured & executed Sept. 12, 1860.",,,Commerce Street at Fourth Avenue North,36.162431,-86.777684,,POINT (-86.777684 36.162431)
44,1971,Timothy Demonbreun,"Jacques-Timothe' De Montbrun, born on Mar. 23, 1741, in Boucherville, Quebec, was the first white man to live in the Nashville area. Beginning in 1769, he spent several winters here trading for furs. He served as Lieut. Gov. of Illinois Country, 1783-86. He became permanent resident of Nashville in 1790, operating store & tavern. Died at home on this site, Oct. 30, 1826.",,wall marker,"Third Avenue North, near intersection with Broadway, wall marker",36.16201,-86.775603,,POINT (-86.775603 36.16201)
200,2019,Josephine Groves Holloway 1898-1988,"Josephine Holloway graduated from Fisk Univ. with a degree in sociology in 1923. She worked at Bethlehem Center as a case worker, where she began organizing the first African-American Girl Scouts troops in Middle Tenn. In 1924 Holloway trained with Girl Scouts founder Juliette Gordon Low. From 1944-63 she worked as the GS Council's first black professional. In 1951 her efforts were central to establishing Camp Holloway, in Millersville, Tenn., for African American girls.",,Council District 34 double sided,4522 Granny White Pike,36.089473,-86.802738,,POINT (-86.802738 36.089473)
204,2019,Hillsboro High School,"Hillsboro High School was built in 1939 to serve rural students between Bellevue and Antioch.  It is named for Hillsboro Pike, which runs along the western boundary of the school property to the former town of Hillsboro in Williamson Co. In 1952, following a complete renovation, the school was destroyed by a fire. Edwin Keeble designed the current mid-century modern building in 1954. It was expanded in 1958 and the campus was renovated in 1995. The iconic clock was added in 1958.",,Council District 25,"Hillsboro High School,  3812 Hillsboro Pike",36.106822,-86.813035,waiting to install,POINT (-86.813035 36.106822)
