Number,Year Erected,Marker Name,Marker Text,Civil War Site?,Notes,Location,Latitude,Longitude,Condition,Mapped Location
111,2003,The Harpeth Hall School,"On Sept. 17, 1951, Harpeth Hall opened as an independent girls' college preparatory school on the former P.M. Estes estate. Susan Souby headed the first school of 161 girls. Originating with Ward Seminary (1865-1913); Belmont College for Young Women (1890-1913); and the Ward Belmont School (1913-1951), Harpeth Hall continued Nashville's tradition of superior single-gender education. Motto: Let us lift up the mind and spirit.",,,3801 Hobbs Road,36.103404,-86.839306,,POINT (-86.839306 36.103404)
70,1978,United Nations Visit to Nashville,"On June 7, 1976, 101 permanent representatives of the United Nations made a historic and unprecedented group visit to Nashville at the invitation of Tennessee Governor Ray Blanton and Nashville Mayor Richard Fulton. During the visit, the United Nations representatives attended a forum at nearby Vanberbilt University, a special Tennessee luncheon in Centennial Park, and a special performance of the Grand Ole Opry. United Nations Secretary-General Kurt Waldheim was presented the Cordell Hull Peace Award by the State of Tennessee and Vanderbilt University during the visit.",,,"Centennial Park, front lawn of Parthenon",36.148817,-86.8119,,POINT (-86.8119 36.148817)
10,1968,Two Rivers Mansion,"Built in 1859 by David H. McGavock, this mansion stands on land inherited by McGavock's wife, Willie, from her father, William Harding.  The smaller house to the left was built in 1802.  Dr. James Priestley's Academy, established about 1816, was located on the 1,100 acre farm 1 mile from the mansion on the Cumberland River bluff.",,,"In front of Two Rivers Mansion, 3130 McGavock Pike",36.189087,-86.674773,,POINT (-86.674773 36.189087)
103,1999,Julia Mcclung Green 1873-1961,"Dedicated educator who served Davidson County public schools 57 years as a teacher, the first Supervisor of Elementary Education 1911-1944 and Director of Character Education, Miss Julia oversaw schools countywide. A progressive, she pioneered school hot lunch and health programs for children, local affiliation with national education organizations, and the local PTA movement.",,,3500 Hobbs Road,36.102407,-86.833444,,POINT (-86.833444 36.102407)
190,2019,Hell's Half Acre,"North and west of the State Capitol was an area city reformers called 'Hell's Half Acre.' Home to immigrants and free and enslaved Blacks, it was a part of a red-light district before, during and after the Civil War. Line St. (now Jo Johnston Ave.) included brothels, bars and secret gambling houses, but the area was also home to a rich African-American culture. Razed as part of the Capitol Hill redevelopment plan in the 1950s, its residents relocated to other parts of the city.",,Marker Project-priority list,,,,NOT UP YET,
73,1981,Assumption Church,"Nashville's second oldest Catholic church, dedicated Aug. 14, 1859, its rectory on right was added in 1874, school on left in 1879. The present altar, windows, and steeple were added later. The Germantown neighborhood grew around it; sermons were often in German until World War I. The parish has produced many nuns and priests including Archbishop John Floersh and Cardinal Stritch.",,double-sided with #74,1227 Seventh Avenue North,36.175419,-86.790929,,POINT (-86.790929 36.175419)
99,1996,Lake Providence Community,"Soon after the Civil War, freed slave families established farms and dairies in this community named for Lake Providence Missionary Baptist Church. The church was founded in 1868 by Rev. Larry A. Thompson, a traveling missionary. The first church building and school stood nearby. Many roads in this area are named for African-American settlers.",,,4500 block Nolensville Road,36.071514,-86.723825,,POINT (-86.723825 36.071514)
147,2013,Fehr School,"Named for local merchant and former school board member Rudolph Fehr, and designed by architects Dougherty and Gardner, Fehr School opened in 1924. On Sept. 9, 1957, Fehr became one of the first schools in Nashville to desegregate, admitting four African American first graders, who attended despite a hostile atmosphere. Some 200 protestors surrounded the school, and it received bomb threats prior to Hattie Cotton School being firebombed shortly after midnight on Sept. 10",,,1624 Fifth Avenue North (Salemtown),36.182203,-86.792432,,POINT (-86.792432 36.182203)
98,1996,Jackson's Law Office,Andrew Jackson settled in Nashville in 1788 and served as Atty. Gen. until 1796. Lawyer John Overton owned a building here (1791-96) and shared office space with his friend Jackson. Jackson was Tennessee's first Rep. to Congress (1796) and state Superior Court judge (1798-1804). He led U.S. troops to victory at the 1815 Battle of New Orleans and was elected President in 1828.,,Donated by the Nashville Bar Association,"333 Union Street, wall marker",36.165185,-86.779712,,POINT (-86.779712 36.165185)
61,1975,Nashville Academy of Medicine,"The Nashville Medical Society, the first medical association in Tennessee, was founded March 5, 1821, by seven physicians in the log courthouse on the Public Square. The first president was Dr. Felix Robertson (1781-1865), son of James and Charlotte Robertson and two-time Nashville mayor. On September 4, 1906, the organization was chartered by the State of Tennessee as the Nashville Academy of Medicine and Davidson County Medical Society.",,Marker Project- prioirty list replaced with new text in 2018,33rd Ave near West End Ave,36.14086,-86.81684,,POINT (-86.81684 36.14086)
193,2019,Club Baron,"Jefferson Street developed as a vibrant African-American commercial district in the late-19th and early-20th century.  As Fisk University, Tenn. A&I (Tenn. State Univ.) and Meharry Medical College grew, more restaurants, shops and music venues opened to cater to nearby residents. Built in 1955 during the golden age of Jefferson Street's music scene (1935-65), Club Baron is the only extant nightclub from that time. Owned by local pharmacist Jackson H. Brown, the building also   served as a secondary location for Brown's Pharmacy, as well as the only skating rink in town for African Americans.  The club is best known as the site of a 1963 guitar duel where Nashville bluesman Johnny Jones bested up-and-comer Jimi Hendrix. Other well-known performers included Fats Domino, Etta James, Little Richard, Otis Redding, Muddy Waters, Jackie Wilson and Ruth McFadden. Now owned by the Elks Lodge, the building was preserved as a local Historic Landmark in 2016.",,Council District 21,2614 Jefferson St.,36.168062,-86.818085,,POINT (-86.818085 36.168062)
65,1976,General Thomas Overton 1753-1824,"Gen. Thomas Overton served in the Revolutionary War and as Inspector of Revenue in N.C., the same position held by his brother Judge John Overton in Tenn. He was one of Gen. Jackson's seconds in duel with Chas. Dickinson. This grave plot was a part of his homeplace, 'Soldier's Rest,' where he lived from 1804 until his death in 1824.",,replaced with updated text 2011,"Donelson Avenue west of Bryan Street, Old Hickory",36.264067,-86.6514,,POINT (-86.6514 36.264067)
17,1969,Chickasaw Treaty,"In 1783, Chickasaw chiefs met with white settlers at a spring 100 yards north and agreed on land rights—the Cumberland country for the settlers, the Tennessee River lands beyond the Duck River ridge for the Chickasaw. This tribe became firm friends of James Robertson and his people, but the settlement suffered many more raids by Cherokees and Creeks.",,,Corner of Morrow Road and Terry Drive,36.163142,-86.863283,,POINT (-86.863283 36.163142)
23,1970,Cumberland Park,"The Cumberland Fair and Racing Association sponsored harness racing here 1891-1894. The great match race between Hal Pointer of Tennessee and Direct of California occurred Oct. 21, 1891. Direct won all three heats in record time for a pacing race. Arion, Directum, Kremlin, Robt. J. raced here. Running races 1893-1906 preceded the State Fair 1906.",,,"State Fairgrounds, intersection of Walsh Road, Rains Avenue, and Wedgewood Avenue",36.132763,-86.764927,,POINT (-86.764927 36.132763)
143,2011,J. W. Price Fire Hall,"Constructed in 1892 for Hose Company #1, this building is one of the earliest extant fire halls in Nashville. The upstairs housed firefighters while the lower floor stabled the company's two horses. R. C. Burk served as the first Captain. The fire hall was renamed for J.W. Price, a local businessman, c1910. In 1993, the building reopened as a branch of the Nashville Public Library, and is named for State Legislators Charles and Mary Pruitt.",,,117 Charles E. Davis Boulevard,36.151752,-86.762035,,POINT (-86.762035 36.151752)
155,2013,Woman Suffrage Rallies,"Centennial Park was the site of May Day rallies held annually from 1914 until 1920, when the Tennessee General Assembly ratified the 19th Amendment to the U.S. Constitution, guaranteeing the right to vote to American women. Suffragists marched from the State Capitol to Centennial Park, where thousands gathered to hear speakers such as Anne Dallas Dudley, Maria Thompson Daviess, Sue Shelton White, and Abby Crawford Milton.",,,"Centennial Park, along 28th Avenue North near Art Center",36.153343,-86.812373,,POINT (-86.81237300000001 36.153343)
34,1970,Hillsboro Toll Gate No. 1,"Ten yds. north stood toll gate and toll gate house erected by Nashville and Hillsboro Turnpike Co., Incorporated in 1848.  Charges to travel macadamized road could not exceed: horse or mule, 3 cents; 10 sheep, 20 cents; 20 meat cattle, 25 cents; carriage drawn by pair of horses or mules, 25 cents.  Toll removed in 1903.  Toll gate house, enlarged, stands 20 yds. northwest.",,,Lawn of fire department near Hillsboro Road and Blair Boulevard,36.129691,-86.802425,,POINT (-86.802425 36.129691)
185,2019,Patsy Cline's Dream House,"This is the 'dream house' of country music icon Patsy Cline, born Virginia Patterson Hensley in 1932. Roy Acuff offered her a job by the age of 16, but she opted to sing with a local group back home in Winchester, Va. She changed her name in 1953 and debuted on the Grand Ole Opry in 1955. She got her big break in 1957 singing 'Walkin' After Midnight' on Arthur Godfrey's Talent Scouts. In 1973, she became the first female solo artist inducted into the Country Music Hall of Fame.",,Marker Project-priority list,815 Nella Drive,36.281195,-86.736146,,POINT (-86.736146 36.281195)
169,2018,Alex Little Page Green (1806-1874),"In 1829, The Rev. Alex Green joined the Methodist Episcopal Church's Nashville Conference. Elected vice-president of the TN Conference's Temperance Society in 1835, Green was instrumental in the Southern Methodist Publishing House's move to Nashville in 1854, and helped establish Shelby Medical College (1857) and Vanderbilt University (1875). By private venture, he opened Union St. from College St. to Market St. c. 1870. This area's first school was renamed Alex Green Academy in 1887.",,Council District 3,"3921 Lloyd Road,  Alex Green Elementary School",36.253871,-86.830129,,POINT (-86.83012900000001 36.253871)
40,1971,James Carroll Napier,"James C. Napier (1845-1940), Nashville Negro lawyer, educator, member of the city council, delegate to four Republican conventions, Register of U.S. Treasury, 1911-1915, was a trustee of Fisk, Howard, and Meharry, advocate of the public schools, and founder of the One-cent Savings Bank, later the Citizens Savings Bank and Trust Co.",,,corner of Lafayette Street and Claiborne Street,36.147631,-86.759859,,POINT (-86.759859 36.147631)
149,2013,Holly Street Fire Hall,"Completed in 1914, J.B. Richardson Engine Company No. 14 was designed by Nashville's first city architect, James B. Yeaman. Designed to blend in with the surrounding residential neighborhood, it was the first fire hall in the city built specifically for motorized fire trucks. Except for short periods during renovations, this fire hall has been in continuous use since its construction, and was listed in the National Register of Historic Places in 1982.",,double-sided,1600 Holly Street,36.175477,-86.74195,,POINT (-86.74195 36.175477)
31,1970,First Airfield,"E. L. Hampton's pasture became 'Hampton Field' when transient airplanes began landing here during the first World War. About 2,000 feet long from here west, bonded north and south by Golf Club Lane and Woodmont Boulevard, it continued in use as Nashville's first airfield about five years until the opening of Blackwood Field in 1921.",,,2305 Hampton Avenue,36.116717,-86.817237,,POINT (-86.817237 36.116717)
91,1993,St. Patrick Catholic Church,"Erected in 1890 and named for Ireland's patron saint, this Second Empire style church was built to serve South Nashville's growing Irish Catholic population. Until 1954, the Sisters of Mercy taught a grade school here. Since the 1890s, the Irish Travelers, a unique clan of American nomads, have come here periodically for weddings and funerals.",,,1219 Second Avenue South,36.144662,-86.764131,,POINT (-86.764131 36.144662)
194,2019,Marathon Motor Works,"This Italianate-style 1881 factory first housed the Nashville Cotton Mills, which built the middle section c. 1885. It became Phoenix Cotton Mills in 1894. In 1910 Southern Motor Works of Jackson, Tenn. moved in, becoming Marathon Motor Works in 1911. The final portion of the plant and an elegant office and showroom across Clinton St. were built in 1912. Marathon made vehicles in Jackson (1907-1910) and here (1910-1914). It operated as a parts and service business until 1918.  In 1906, William H. Collier, engineer at Southern Engine and Boiler Works in Jackson, Tenn. designed the 'Southern' car, renamed 'Marathon' after a 1909 contest. Marathon Motor Works' roadsters, touring cars, coupes, limousines, and trucks were sold worldwide with four-cyl. engines ranging from 20-45 hp. The 'Marathon' was the first car entirely manufactured in the South. In 1986, Barry L. Walker began redeveloping the complex into a creative community called Marathon Village.",,Marker Project- prioirty list replaced #26 Marathon Motor Car,1200 Clinton Street,36.164514,-86.795973,,POINT (-86.795973 36.164514)
195,2019,Nashville School of Law,"Founded in 1911 by the Young Men's Christian Association, the Nashville YMCA Night Law School was created to make legal education accessible to working-class people. The School shared space on the 3rd floor of the YMCA at 7th & Union with the John Hill Eakin Educational Institute and moved to the basement of the Church St. YMCA before moving to its own campus in 1991. Renamed the Nashville School of Law in 1986, it is the only remaining independent law school created by the YMCA.",,Marker Project- prioirty list,900 Church Street,36.161285,-86.784822,,POINT (-86.784822 36.161285)
102,1997,Saint Thomas Hospital,"On April 11, 1898, at the request of Nashville Bishop Thomas Byrne, the Daughters of Charity opened Saint Thomas Hospital on this site in the former home of Judge J. M. Dickinson. Named for Byrne's patron saint, the hospital began as a 26-bed 'refuge for the sick,' opened a new building in 1902, operated a School of Nursing, and grew to 333 beds before moving in 1974 to 4220 Harding Road.",,,Hayes Street betweenTwentieth Avenue North and Twentiest-First Awvenue North,36.15215,-86.800731,,POINT (-86.800731 36.15215)
15,1969,Powder-grinding Wheels,"These wheels used by the Confederacy to grind gunpowder at Augusta, Ga., in 1863-1864 were made in Woolwich, England and were shipped on the blockade runner 'Spray,' via Mobile. After the war Gen. Miles purchased them for use at Sycamore Powder Mills, Cheatham County. They were exhibited at the Tennessee Centennial Exposition in 1897.",,,"Near present position of wheels in Centennial Park, by Park Plaza entrance",36.146436,-86.809605,,POINT (-86.809605 36.146436)
64,1976,Adolphus Heiman 1809-1862,"Born in Potsdam, Prussia. Came to Nashville 1838. Lived in home on this site. Architect, Engineer & Builder. Designed Univ. of Nash. Main Bldg.; Central State Hosp. Main Bldg.; Suspension Bridge over Cumberland River. Masonic Leader; Adj. U.S. Army Mexican War; Col. 10th Tenn. Inf. Reg. C.S.A. Civil War. Buried in Confederate Circle Mount Olivet Cemetery.",,,corner of Jefferson Street and 9th Avenue North,36.173077,-86.792451,,POINT (-86.792451 36.173077)
164,2018,Antioch Pike,"The Mill Creek Valley Turnpike Company was incorporated by the Tenn. Gen. Assembly on Jan. 21, 1846. Starting near the four mile mark of Nolensville Pike, the road went through Mill Creek valley, 'crossing main Mill creek at or near Rains' mills, passing Antioch meeting house' and continuing south. Tollbooths could be established every five miles to pay for the completion of the road. The name was changed to Antioch Pike in October 1928.",,Marker Project-priority list,2360 Antioch Pike,36.06097,-86.674603,,POINT (-86.674603 36.06097)
121,2005,Belle Meade Golf Links Historic District,"Platted in 1915 by developer Johnson Bransford, Belle Meade Golf Links is one of the early subdivisions that arose from the dissolution of the world-famous Belle Meade Plantation. This small residential district represents early 20th century subdivision design and is listed in the National Register of Historic Places.",,,"Belle Meade Golf Links, Intersection of Windsor Drive and Blackburn Avenue",36.101873,-86.865887,,POINT (-86.865887 36.101873)
25,1970,Transfer Station Site,"Site of electric street railway transfer station 1902-1940. Electric streetcar service began formally on April 30, 1889 replacing mule-drawn streetcars which had served the city since 1866. Final run for the electric streetcars was February 2, 1941 on Radnor line. Operation of bus system began Aug. 4, 1940 on Hillsboro-Sunset line",,,Near corner of 3rd Avenue and Deaderick Street,36.166283,-86.779355,,POINT (-86.77935500000001 36.166283)
134,2008,"Battle of Nashville (december 16, 1864) Confederate Final Stand","After the withdrawal from the main Confederate line at Peach Orchard Hill, Lt. Gen. Stephen D. Lee formed a battle line across Franklin Pike 400 yards east of here with 200 men from the remnants of Brig. Gen. Henry Clayton's division and two cannons from the Eufaula Light Artillery. This last line of defense halted the Federal pursuit for the night as the Confederate army retreated through the hills to the southwest.",TRUE,,827 Tyne Blvd,36.077687,-86.777135,,POINT (-86.777135 36.077687)
177,2018,The Old Woman's Home,"On Dec. 17, 1891, the Tenn. legislature granted a charter establishing the Old Woman's Home 'for the care and protection of aged and helpless women.' In 1909, the women moved from 136 Cherry St. (4th Ave) to a new home at 2817 West End Ave. Later renamed The West End Home for Ladies, it was home to hundreds of elderly women until it was demolished in 1984. The West End Home Foundation continues this legacy of enriching the lives of older adults through grantmaking and advocacy.",,donated by the West End Home Foundation,2817 West End Avenue,36.144546,-86.812959,,POINT (-86.812959 36.144546)
87,1992,Nashville Sit-ins,"Formerly located at this site was First Baptist Church, Capitol Hill, headquarters of the 1960s Sit-In Movement, led by Rev. Kelly Miller Smith. Strategy sessions, non-violence workshops, mass meetings, victory celebrations, and administrative offices were here. The well-disciplined Nashville Sit-Ins served as a model for civil rights demonstrations throughout the South.",,,Eighth Avenue North and Charlotte Pike,36.164366,-86.785667,,POINT (-86.785667 36.164366)
109,2001,Ward's Seminary,"Ward's Seminary for Young Ladies, founded in 1865 by Dr. William E. Ward, stood at this site many years. Dr. Ward, a graduate of Cumberland University in Lebanon in both law and divinity, died in 1887. The school was sold, but continued to operate as Ward's Seminary until 1913 when it merged with Belmont College to form Ward-Belmont, a high school and junior college for women. Ward's was regarded as one of the leading schools for young women in the South.",,wall marker,272 Rosa L Parks Blvd,36.160131,-86.781836,,POINT (-86.781836 36.160131)
13,1969,Mrs. John Donelson,"After Col. John Donelson was killed in 1785, his widow and family continued to live here in a log house.  In 1789 lawyers Andrew Jackson and John Overton boarded with the Donelsons.  Here Jackson met Rachel, the Donelson's youngest daughter.  They married in 1791 and lived here until they acquired there own home across the Cumberland in 1792.",,,"Gallatin Pike (Hwy 31) near Myatt Drive intersection, 1787 Gallatin Pike North",36.296461,-86.699971,,POINT (-86.699971 36.296461)
105,1999,Duncan College Prepartory School for Boys,"Marvin T. Duncan, a graduate of Webb School (Bell Buckle) and Vanderbilt University, founded Duncan School in 1908 at this site on 25th Avenue, S. He and his wife, Pauline, taught at the school until it closed in 1952. The Duncans dedicated their lives to training boys in high principles of honor and scholarship. The school graduated some 752 men and 6 women, including many community leaders.",,,Twenty-fifth Avenue South in front of Vanderbilt Memorial Gym,36.143922,-86.806374,,POINT (-86.806374 36.143922)
192,2019,Cockrill Bend,"In 1786, the State of N.C. granted Gen. James Robertson several large tracts of land in this area. Robertson's Bend was renamed after the Cockrill family who established several farms and a mill here before the Civil War. The Romanesque-style third Tenn. State Penitentiary, designed by Chattanooga architect S.M. Patton, was built from 1893-97 and had 50 buildings. It closed in 1992. Ford Glass Plant opened in 1956 as one of the world's largest automobile glass manufacturers.",,Council District 20,Centennial Blvd. at Bomar Blvd.,36.171287,-86.862782,,POINT (-86.862782 36.171287)
170,2018,Cora Howe's 'wildings',"This house, built from Sewanee stone, was the home of Cora Howe, who created a bucolic, English-style garden here in the early 1920s. Known as 'Wildings,' her garden contained over 300 plant types, many of them native species, and a rare, thatched-roof tool house. Mrs. Howe was wholly dedicated to the unique garden estate, and opened it to the community for nearly 40 years. After her death in 1968, the gardens were transplanted to Cheekwood.",,Council District 6 doiuble sided,1921 Greenwood Avenue,36.189347,-86.735033,,POINT (-86.735033 36.189347)
170,2018,Eastland,"The Eastwood area, a suburb originally named Eastland in 1901, was laid out as the Brownsville plan in 1855, the land carved from the Weakley tract. Their c.1855 house remains at the northeast corner of Chapel and Greenwood.  Eastland Avenue, previously Vaughn's Pike, was named for and led to a 19th century farm near the river. The old Eastland School, now Eastland Park, was acquired in 1953 by the Park Board and functioned as a community center until the building was demolished.",,Council District 6 double sided,1921 Greenwood Avenue,36.189347,-86.735033,,POINT (-86.735033 36.189347)
178,2018,Centenary United Methodist Church,"Rev. William Gower built the first Gower's Chapel on his farm in 1805. A larger chapel, erected in 1850 on Gower land, also served as the local schoolhouse. On Oct. 5, 1884, the newly named Centenary Methodist Church was dedicated by Bishop Holland McTyeire. In 1922, the church relocated again. The new building was destroyed by a tornado on March 11, 1923, but was rebuilt within the year. Centenary United Methodist Church continues to worship at the same location on Gower Rd.",,double sided,6809 Gower Road,36.126892,-86.932021,,POINT (-86.932021 36.126892)
150,2013,Sylvan Park School,"A two-room frame school building was constructed here in 1907 to serve the children of newly-annexed West Nashville. Students in grades 1-8 attended here, and a second two-room building was added in 1909 for students in grades 1-4. Maria Wilson Hill served as first principal. In 1936, the Public Works Administration funded the construction of the current Art Deco building, designed by the architectural firm of Asmus and Clark.",,,"Sylvan Park School, 4801 Utah Avenue",36.144462,-86.844438,,POINT (-86.844438 36.144462000000004)
16,1969,Belmont Mansion,"This mansion was built in 1853 as a summer home for Joseph and Adelicia Acklen. An 1860 addition by architect Adolphus Heiman expanded the mansion's size to 36 rooms. The entrance to the 177 acre estate, which featured gardens decorated with marble statues and cst iron gazebos, was on Hillsboro Pike. Also on the grounds were greenhouses, a water tower, bowling alley, zoo, art gallery and deer park.",,replaced with updated text 2011,Belmont Campus in front of the mansion,36.135298,-86.794819,,POINT (-86.794819 36.135298)
18,1969,Johnson's Station,"In 1783, the State of North Carolina granted Cumberland Compact signer Isaac Johnson 640 ac. on Richland Creek. He settled near Johnson's Lick, a spring on a buffalo path to the southwest. By 1787, a double log house and partially picketed cabins named Johnson's Station stood here as a fort and tax collection site. Vacated in Jan. 1789, the station burned five months later. Charles Bosley, a wealthy member of the Nickajack Expedition and plantation owner, settled here in 1818.",,Marker Project- prioirty list replaced with updated text 2018,Harding Pike/ Memphis-Bristol Hwy and Vine Court,36.129844,-86.839452,,POINT (-86.839452 36.129844)
4,1968,Nashville Plow Works,"Site of a farm implement factory operated by Messrs. Sharp and Hamilton, previous to the War Between the States.  With the out-break of hostilities they reversed the Biblical injunction and produced swords of excellent quality for the Confederacy.  With the coming of the Federal Army, the making of swords was discontinued.",,,SE corner of Eighth Avenue South and Palmer Place,36.15339,-86.779382,,POINT (-86.779382 36.15339)
