Number,Year Erected,Marker Name,Marker Text,Civil War Site?,Notes,Location,Latitude,Longitude,Condition,Mapped Location
94,1995,Votes for Women,"On August 18, 1920, Tennessee became the 36th state to ratify the 19th Amendment to the U.S. Constitution, thereby giving all American women the right to vote. After weeks of intense lobbying by national leaders, Tennessee passed the measure by one vote. The headquarters for both suffragists, wearing yellow roses,  and anti-suffragists, wearing red roses, were in the Hermitage Hotel.",,,Union Street and Capitol Boulevard,36.164158,-86.782348,,POINT (-86.782348 36.164158)
82,1982,Oglesby Community House,"Built 1898, the Mary Lee Academy, the second school in the Oglesby Community, was named for its first teacher, Miss Mary Lee Clark. The county bought the school in 1906. The name changed to Ogilvie in honor of the land donor, Benton H. Ogilvie, and later became Oglesby. In 1943, the schoolhouse was given back to the Oglesby Community.",,,5724 Edmondson Pike,36.037807,-86.743326,,POINT (-86.743326 36.037807)
68,1976,Edmondson Home Site,"Will Edmondson, born about 1883 of former slave parents in the Hillsboro area of Davidson County, worked as a railroad and hospital laborer until 1931, when he began his primitive limestone carvings. Working without formal training, he produced some remarkable sculptures which won high praise in exhibits across the nation. He died in 1951.",,,"Fourteenth Avenue South, north of Wade Avenue",36.137383,-86.790549,,POINT (-86.790549 36.137383)
53,1975,Frederick Stump 1724-1822,"Frederick Stump, an early settler in the Fort Nashboro area came from Pennsylvania by way of Georgia.  He was a Revolutionary War soldier & noted Indian fighter.  He owned a large plantation along White's Creek where he operated a mill & inn & rented land to other settlers.  This log house is said to have been his home and inn.",,,4949 Buena Vista Pike,36.231955,-86.824931,,POINT (-86.824931 36.231955)
196,2019,Freedman's Savings and Trust Company Bank,"In March 1865, Congress established the Freedman's Savings and Trust Company Bank. A Nashville branch was chartered in Dec. 1865. By 1867, there were 37 branches, mostly in the South. Liberty Hall was built at 44 Cedar Street in 1871 to serve as home to the bank. Despite local successes, federal mismanagement and corruption led to the closure of all branches in 1874. In 1909, another African-American bank, the People's Savings Bank and Trust Co., opened at 410 Cedar Street.",,Marker Project- prioirty list double sided,330 Dr. M.L.K. Jr. Blvd.,36.166414,-86.780457,,POINT (-86.780457 36.166414)
135,2009,The Seeing Eye Independence and Dignity Since 1929,"The Seeing Eye, the world-famous dog guide training school, was incorporated in Nashville January 29, 1929, with headquarters in the Fourth and First National Bank Building at 315 Union St. Morris Frank, a 20-year-old blind man from Nashville, and his guide dog, Buddy, played a key role in the school's founding and subsequent success. It was Frank who persuaded Dorothy Harrison Eustis to establish a school in the United States.",,,Union Street at Third Avenue North,36.165579,-86.778611,,POINT (-86.778611 36.165579)
132,2008,Dry-stack Stone Walls,"Dry-stack stone walls, a Scots-Irish building tradition adapted by slaves in the early 19th century, were common throughout middle Tennessee. During the 1864 Battle of Nashville, Brigadier General Henry Jackson was captured at this wall on the Middle Franklin Turnpike after the Confederate line collapsed at Shy's Hill.",TRUE,,4708 Granny White Pike,36.085384,-86.804379,,POINT (-86.804379 36.085384)
138,2010,Hill Forest,"In 1910, H.G. Hill, Sr. purchased this 324 acres including an old-growth forest west of downtown Nashville. He refused to allow the trees to be sold for timber, and fenced the forest to keep his cattle from damaging the centuries-old trees. Hill enjoyed its pristine beauty throughout his lifetime. In 2009, the Friends of Warner Parks purchased the land from the Hill family, ensuring that this ancient forest in an urban setting will continue to be preserved.",,,6811 Highway 70 South,36.079758,-86.903032,,POINT (-86.903032 36.079758)
200,2019,Girl Scouts of Middle Tenneesee,"In 1917, five years after Girl Scouts was founded in Savannah, Ga., the first troops were formed in Nashville. By 1927 there were enough troops and community support to join the national organization as the Nashville Girl Scouts Council. The first headquarters was built in 1964 at 830 Kirkwood Ave. and moved to Granny White Pike in 1991. Now called Girl Scouts of Middle Tenn., they still strive to build girls of courage, confidence and character who make the world a better place.",,Council District 34 double sided,4522 Granny White Pike,36.089473,-86.802738,,POINT (-86.802738 36.089473)
148,2013,Cohn School,"Designed by architects Asmus and Clark and opened in 1928 as a junior high school, Cohn School was named in memory of Corinne Lieberman Cohn, one of the first female members of the school board.  Jonas H. Sikes served as first principal. The school added high school grades in 1937, and graduated its first high school class in 1940. Following school desegregation, Cohn High merged with Pearl High in 1983. The building now serves as the Cohn Adult Learning Center.",,double-sided,"Cohn School, 4805 Park Avenue, (Sylvan Park)",36.150993,-86.84525,,POINT (-86.84525 36.150993)
88,1992,Tennessee Ornithological Society,"On October 7, 1915, Dr. George Curtis, Albert F. Ganier, Judge H.Y. Hughes, Dr. George R. Mayfield, Dixon Merritt, and A.C. Webb met at Faucon's Restaurant, 419 Union Street, approximately 50 feet east of here, to found the Tennessee Ornithological Society. T.O.S. was chartered by the state for the purpose of studying Tennessee birds. A journal, The Migrant, publishes accurate records of birds across the state. The Birds of the Nashville Area has local records. T.O.S. is the state's oldest conservation group in continuing existence.",,Donated in memory of B.B. Coffey (1870-1966).,"Union Street, between Fifth Avenue North and Arcade Alley, wall marker",36.165814,-86.780806,,POINT (-86.780806 36.165814)
1,1968,Heaton's Station,"Heaton's Station (also called Old Heaton Station, Eaton Station, and Heatonsburg) was founded by Amos Heaton after arriving here with James Robertson in Dec. 1779. Stations founded by others in the surrounding area included: Fort Union, Freelands, Nashborough, Stones River, Mansker, Asher, and Bledsoe. By 1783, only two stations remained, Heaton and Nashborough. The Heaton family moved west in 1786 to New Heaton Station, along the present-day Eaton Creek area of Whites Creek.",,Marker Project- prioirty list replaced with updated text 2018,Lock Road at Baptist World Center Dr.,36.201212,-86.788031,,POINT (-86.788031 36.201212)
186,2019,Nashville Porter and Ale Brewery,"In 1815, T.M. Burland opened a small brewery 1.5 miles west of Nashville along Cockrill Spring. The brewery used water from the nearby spring and barley purchased from local farmers. J.T. and W.B. Smith operated the brewery from 1834 until it was purchased by P. Jonte and J.B. Bergerot in 1838. The brewery closed in 1841. Coincidently, S. Weins and K. Taylor co-founded the Blackstone Brewery near this location in 1994, on the same tract of land as the Porter and Ale Brewery.",,donated by Scott Mertie family,1901 Charlotte Ave.,36.157522,-86.801631,,POINT (-86.801631 36.157522)
140,2011,Bradley Studios,"In 1955, brothers Owen and Harold Bradley built a recording studio in the basement of a house on this site. They added another studio here in an army Quonset Hut, producing hits by Patsy Cline, Red Foley, Brenda Lee, Marty Robbins, Sonny James, and others. Columbia Records purchased the studios in 1962. The studio established its reputation in the music industry with hits by stars including Johnny Cash, Bob Dylan, Roger Miller, George Jones, and Tammy Wynette.",,Donated by the Mike Curb Foundation,34 Music Square East,36.149432,-86.792024,,POINT (-86.792024 36.149432)
6,1968,Battle of Nashville Stewart's Line,"Loring's division of Stewart's Corps, Hood's Confederate Army of Tennessee, fought behind this stone wall Dec. 16, 1864.  All Federal attacks were beaten back until the Confederate line was broken a mile to the west.  The division retreated south through the hills toward Brentwood.",TRUE,,4618 Lealand Lane,36.086311,-86.791167,,POINT (-86.791167 36.086311)
90,1992,University School of Nashville,"Founded in 1915 as the successor to The Winthrop Model School at the University of Nashville, Peabody Demonstration School was established at this site in 1925 to utilize the teacher training methods developed at George Peabody College for Teachers. It became an independent institution in 1975 and was renamed University School of Nashville.",,,2000 Edgehill Avenue,36.14399,-86.798228,,POINT (-86.798228 36.14399)
168,2018,May-granbery House and Alford Cemetery,"Revolutionary War Pvt. John Alford built a two-room house on this land c. 1810, expanding it in 1812 and 1820. The Alford cemetery retains three markers that were placed as early as 1822. The c.1830 brick two-story Federal dwelling was home to James F. May, grandson of Knoxville founder Gen. James White. May purchased the land in 1837 and resided here until his death. James T. Granbery inherited and restored the house in 1939, and established Seven Springs Farm on the estate.",,Council District 4,621 Hill Road,36.047802,-86.754991,,POINT (-86.754991 36.047802)
19,1969,Meharry Medical College,"Meharry Medical College, established in 1876 through the efforts of Dr. George W. Hubbard, Dr. William J. Sneed, and Samuel Meharry, is the only AMA Accredited, privately endowed, predominantly Negro medical school in the world. During its first 90 years of service, it trained more Negro physicians and dentists than any other institution.",,replaced 2012,"Meharry Medical College, D.B. Todd Boulvard entrance",36.16677,-86.805937,,POINT (-86.805937 36.16677)
29,1970,Madison College,"Madison College was founded in 1904 as Nashville Agricultural Normal Institute by Seventh-day Adventists on a farm of 412 acres. A sanitarium and campus industries were integral to the plan of work and study for students training for careers in agriculture, teaching, religion, industrial arts, nursing and allied health courses, and other fields.",,,"Hospital Drive off of Neely's Bend Road, Madison",36.250539,-86.683834,,POINT (-86.683834 36.250539)
62,1976,Newsom's Mill,"The original Newsom's Mill was located upstream & was destroyed by flood in 1808. Joseph M. Newsom constructed this turbine-powered gristmill in 1862 of hand-dressed limestone cut from Newsom's quarry, a mile south. Newsom's stone is found in many important buildings in the city of Nashville.",,,"Charlotte Pike (Hwy 70), between Buffalo Road and Huntwick",36.0917,-86.986567,,POINT (-86.986567 36.0917)
126,2008,"Battle of Nashville (december 16, 1864) Assault on the Barricade","During the retreat from Nashville, Colonel Edmund Rucker's brigade attempted to block the Union pursuit by erecting a barricade of fence rails and logs across Granny White Pike, 1/2 mile south of this spot. During the ensuing night attack by Union cavalry, fierce hand-to-hand fighting took place until the position finally was overrun around midnight, with Rucker wounded and then captured.",TRUE,Donated by Richland Country Club,Granny White Pike at Richland Country Club,36.050964,-86.816416,,POINT (-86.816416 36.050964)
183,2018,Kenner Manor Historic District,"Originally part of the Woodlawn estate, this property was subdivided in 1916 by Duncan Kenner and the Kenner Manor Land Company. Many houses on Kenner Avenue and Woodmont Circle were built in the 1920s, and in 1929 the Clearview Subdivision was platted on Crescent Road and Clearview Drive. The neighborhood's early-20th-century homes retain much of their original character. The Kenner Manor Historic District was listed in the National Register of Historic Places in 2016.",,,Kenner Ave. at Woodmont Cir.,36.119153,-86.840325,,POINT (-86.840325 36.119153)
212,,Betty Chiles Nixon,"Betty Nixon was a trailblazing woman in Nashville politics, an ardent preservationist, and a relentless advocate for the city's people and neighborhoods. She served on the Metro Council from 1975 to 1987, was the first woman to chair its Budget and Finance Committee, and ran for mayor in 1987 and 1991. Nixon and her first husband, U.S. District Judge John T. Nixon, purchased this 1925 Colonial Revival house in 1971. It was the setting for her campaigns and community activism.",,,1607 18th Avenue South,36.138601,-86.796764,ordered/ not arrived,POINT (-86.796764 36.138601)
115,2003,Ezell House,"In 1805 Jeremiah Ezell (1775-1838) moved here from Virginia and purchased 17 acres of land on Mill Creek. In 1816 he served on the Court of Pleas for Davidson County. In 1888, his grandson, Henry Clay Ezell, built this brick vernacular Queen Anne style house. His large farm was known for breeding fine mules from stock imported from Spain.",,replaced in 2017,Corner of Old Ezell Road and Donelson Pike/Harding Place     652 Old Ezell Road,36.098286,-86.677242,,POINT (-86.677242 36.098286)
202,2019,Contemporary Christian Music,"Religious music was integral to Nashville's identity as 'Music City,' from early music publishing houses to the international impact of the Fisk Jubilee Singers. Key artists nurtured locally in the 1970s eventually crossed over to mainstream fans and by the 1990s, Contemporary Christian and Gospel Music outsold jazz and classical. Nashville also became the capital of this new genre, serving as home to the Gospel Music Association, major labels and a growing creative community.",,"double sided Sponsored by Capital Christian Music Group, Curb|Word Entertainment, and Provident Label Group",1000 16th Ave S,36.146636,-86.792464,,POINT (-86.792464 36.146636)
11,1968,Samuel Watkins 1794-1880,"Brick manufacturer and builder, who fought under General Andrew Jackson in the Creek campaigns and at the Battle of New Orleans, left at his death in 1880 property and $100,000 as an endowment for a school later called Watkins Institute, organized in 1885. A pioneer school for adult education, and a leader in arts education, it has been in continuous operation since 1889.",,moved to Watkins College of Art and Design with updated text ( 2011),2298 Rosa L Parks Boulevard,36.193756,-86.806218,,POINT (-86.806218 36.193756)
124,2007,First Baptist Church East Nashville,"Founded in 1866 under the direction of Rev. Randall B. Vandavall, First Baptist Church East Nashville built. This Classical Revival building between 1928 and 1931, during the height of Rev. W.S. Ellington's career. Nashville artist Francis Euphemia Thompson painted the distinctive baptistry murals in the 1950s and 1960s. At that time the church served as a frequent meeting place for the African-American community during the Civil Rights Movement.",,Donated by FBC East Nashville,601 Main Street,36.1739,-86.762598,,POINT (-86.762598 36.1739)
201,2019,Turner Grammar School,"By 1800 Whitsett's Chapel became this area's first school.  In Jan. 1899 Flat Rock native, philanthropist and real estate developer R.W. Turner and wife Sallie W. Turner gave 2 acres for a new 9th dist. public school.  The first Turner School was overcrowded by the 1920s.  Designed by architect George D. Waller, Turner Grammar School opened in 1926 with Otto Prather as principal.  The cafetorium dates to 1950.  An annex of Cole Elem. in its final years, the school closed in 1989.",,Council District 15,2949 Nolensville Pike,36.108371,-86.744044,,POINT (-86.74404400000002 36.108371)
81,1982,Cane Ridge Cumberland Presbyterian Church,"Cane Ridge Cumberland Presbyterian Church, built in 1859, replaced a log building which occupied land donated by Edwin Austin & Thomas Boaz in 1826. One of the best known pastors was Hugh Bone Hill who also preached at the Jerusalem Church in Rutherford County. Isaac Johnson, a Revolutionary War soldier, died 1839 & is buried in the church cemetery.",,,"13411 Old Hickory Boulevard, Antioch",36.000746,-86.634162,,POINT (-86.634162 36.000746)
182,2018,Nettie Napier Day Home Club,"Nettie Langston Napier had a Day Home Club on this site by 1907. It provided childcare, meals, education and healthcare for the children of poor, working African American mothers. Napier appointed a vice president for each of the city's wards, each responsible for soliciting funds and donations. The wife of prominent banker, lawyer and public figure James C. Napier, Nettie Langston Napier was a talented musician, avid social activist and member of the women's club movement.",,Marker Project-priority list,6144th Ave S,36.154218,-86.772692,,POINT (-86.772692 36.154218)
71,1980,Disciples of Christ Historical Society,"Library and archives of the 19th c. American religious unity movement which became: the Christian Church (Disciples of Christ); Christian Churches; and Churches of Christ. Located here, 1958, in the Thomas W. Phillips Memorial. Architects: Hoffman & Crumpton; Hart, Freeland & Roberts. Sculptor: Puryear Mims. Stained glass artist: Gus Baker.",,,1101 Nineteenth Avenue South,36.145665,-86.797425,,POINT (-86.797425 36.145665)
153,2013,Cockrill School,"Through the efforts of Mark Sterling Cockrill and Lemuel Davis, a school serving West Nashville children in grades 1-8 opened near here in 1888. High school grades were soon added and the school became West Nashville High School. Following annexation, the school was renamed Cockrill School in 1907. The Public Works Administration constructed the current building at this location, the former Clifton Park. Designed by Marr and Holman, this building opened in 1940.",,,610 49th Avenue North,36.154561,-86.846068,,POINT (-86.846068 36.154561)
46,1971,Hyde's Ferry Turnpike,"Here was toll-gate No.2 of the Hyde's Ferry Turnpike Co., chartered in 1848 to build a road from Nashville to Ashland City and Sycamore Mills.  Richard Hyde's ferry crossed the Cumberland 2.6 mi. southeast, where the railroad bridge is now.  Davidson County paid $10,000 for its part of the road in 1901.  Cheatham County bought its portion and freed it from tolls in 1916.",,,"Ashland City Highway/Hydes Ferry Road, between Cato Road and Eatons Creek Road",36.208889,-86.864167,,POINT (-86.864167 36.208889)
136,2009,Scottsboro,"In 1869, Tom Scott opened a general store 500 yards to the southwest on Old Hyde's Ferry Pike that also served as a post office and public gathering place. Scott's Store became the center of this farming community, which stretches north to Joelton and south to the tip of Bells Bend. The unincorporated crossroads community was called Scott's Store until 1902, when it was renamed Scottsboro.",,double-sided,Old Hickory Blvd at Ashland City Highway,36.211694,-86.920493,,POINT (-86.920493 36.211694)
3,1968,Site of First Store,"Lardner Clark, 'Merchant and Ordinary Keeper,' came from Philadelphia, Penn. in the early 1780s with ten horses packed with goods to sell. He established Nashville's first drygoods store by 1783, on a site 30 yards east. Clark sold calicoes, unbleached muslin, thimbles, pins, liquors, and provender for horses. Many customers traded pelts and furs for his goods. The building—which served as a store, tavern, and dwelling—faced south and was known as 'the house with the piazza.'",,Marker Project- prioirty list replaced with updated text 2018 wall marker,NE corner of Second Avenue North and Banks Street,36.234238,-86.777439,,POINT (-86.777439 36.234238)
67,1976,Waverly Place,"About 100 yards east stood Waverly, the home of A.W. Putnam, a writer and historian. The house was named for the Waverley Novels by Sir Walter Scott. Putnam sold Waverly in 1858, and in 1887 the land was conveyed to a real estate syndicate—the Waverly Land Co.  The land was subdivided into lots, and became a streetcar suburb serviced by the Waverly Place-Glendale Park line. Several of the streets—Grantland, White, and Ridley—are named for members of the land syndicate.",,Marker Project- prioirty list replaced with updated text in 2018,Benton Avenue near Eigth Avenue South,36.132515,-86.778657,,POINT (-86.778657 36.132515)
199,2019,Jewish Community Center Bombing,"At 8:07 p.m. on Sunday, March 16, 1958 a bomb exploded at the Jewish Community Center at 3500 West End Avenue. The JCC, which was located here from 1952-84, often hosted community meetings aimed at desegregating Nashville's schools and communities based on the Jewish values of equality and justice for all. Rabbi William Silverman received a call from the 'Confederate Underground' claiming responsibility for the bombing.  The JCC opened one day later to demonstrate its resilience.",,Council District 24,440 Greenway entrance at West End Avenue,36.136352,-86.822402,,POINT (-86.822402 36.136352)
114,2003,Germantown Historic District,"European immigrants established Germantown, the first suburb in North Nashville, in the 1850s. Large brick townhouses stood next to modest workers' cottages, illustrating the area's economic and social diversity. World War I and changes in public attitude began decades of decline. Renovation projects at two historic churches began the neighborhood's revitalization in the 1970s. Germantown became a National Register Historic District in 1979.",,,"Jefferson Street, between Sixth Avenue North and Seventh Avenue North",36.173883,-86.789012,,POINT (-86.789012 36.173883)
188,2019,May Hosiery Mills,"In 1897, Jacob May and his family moved to Nashville and opened the Rock City Hosiery Mill. May obtained a contract to use convict labor for his mill, located inside the state penitentiary on Church Street. In 1908, May incorporated the company under a new name—May Hosiery Mills—and opened a new location next to the Louisville & Nashville railroad terminal on Brown St. in South Nashville. Jacob ran the mill with the help of his sons, Mortimer and Dan, until his death in 1946.   In the early 20th century, the mill was among the largest employers in Nashville. It employed many Jewish refugees the May family helped flee Nazi Germany in the 1930s. For much of the mill's 88 years, its hundreds of employees, mostly women, manufactured a million socks a week. The factory supplied major department stores nationwide and made the socks worn by the NASA Apollo 11 crew. The mill ceased operations in 1985 and has since served as space for artists and businesses.",,Council District 17,429 Chestnut Street,36.143634,-86.769339,,POINT (-86.769339 36.143634)
127,2008,Una Community,"The Una community developed around the crossroads of Smith springs road and Old Murfreesboro Pike in the early 19th century. The local postmaster changed the community name from Rowesdale, or Rosedale, to Una in 1882, honoring a Peabody college student much loved by local residents. Home to schools, churches, a general store, and a service station, this bustling tightly-knit rural community was supplanted by suburban development by the end of the 20th century.",,Sponsored by Metro Council member Vivian Wilhoite,Smith Springs Road and Old Murfreesboro Road,36.096776,-86.654516,,POINT (-86.654516 36.096776)
76,1982,Customs House,"President Rutherford B. Hayes laid its cornerstone in 1877. Designed by Treasury Department architect W.A. Potter, it was occupied in 1882 by collectors of customs and internal revenue, U.S. courts, and Nashville's main post office. Addition to rear began in 1903, wings in 1916. Declared surplus in 1976, then given to the City, it was renovated by the development firm that leased it.",,,701 Broadway,36.15909,-86.781309,,POINT (-86.781309 36.15909)
171,2018,Smith-carter House,"This stone, Monterey-style house was built in 1925 and purchased in 1952 by 'Mr. Country,' Carl Smith, just weeks before his marriage to June Carter, of the famed Carter Family. The farm remained home to June and daughter Carlene after the couple's 1956 divorce, during which time The Carter Family became a regular Grand Ole Opry act. In 1963, June wrote 'Ring of Fire' here with Merle Kilgore, a certified Gold single recorded soon after by Johnny Cash and The Carter Family.   The Carter Family toured with Cash, often appearing on his show. June and Johnny recorded several duets and married in 1968. Family matriarch 'Mother Maybelle' Carter, who developed the transformative 'Carter Scratch' guitar picking style, moved here with husband Ezra in 1971 during his illness. Inducted into the Country Music Hall of Fame in 1970, Maybelle was featured on the 1972 Nitty Gritty Dirt Band album Will the Circle Be Unbroken. She stayed here until her death in 1978.",,Council Distric 8,1020 Gibson Drive,36.251452,-86.722541,,POINT (-86.722541 36.251452)
72,1981,Mansker's First Fort,"Here on west bank of the creek that he discovered in 1772, Kasper Mansker and other first settlers built a log fort in 1779. John Donelson's family fled here in 1780 for safety from Indians. Mansker abandoned the fort in 1781 and moved to Fort Nashborough. He returned in 1783, built a stronger stockade on east bank of the creek a half mile upstream, and lived there until he died in 1820.",,there is also a Tennessee Historical Commision on the same side of the street--3A 146,"Goodlettsville, on Long Hollow Pike between Northcreek Boulevard and Jackson Road",36.322626,-86.690376,,POINT (-86.690376 36.322626)
24,1970,Lockeland Spring,"Located 250 yds. S.E., this famous pioneer spring served Lockeland mansion on site of present school building. Home built by Col. Robert Weakley in early 1800's and named for his wife, daughter of Gen. Matthew Locke of Salisbury, N.C. Spring water won prize at St. Louis Exposition in 1904, for its 'unique mineral composition and salubrious quality.'",,,corner of Woodland Street and North 17th Street,36.176729,-86.739668,,POINT (-86.739668 36.176729)
